{
  "title": "Example Monitor",
  "public_id": 42,
  "state": "active",
  "severity": "SEV-1",
  "customer_impacted": true,
  "customer_impact_scope": "example_value",
  "customer_impact_start": "example_value",
  "customer_impact_end": "example_value",
  "customer_impact_duration": 42,
  "created": "example_value"
}